[{"icaoId":"SKSM","receiptTime":"2026-08-05T13:02:38.632Z","obsTime":1785934800,"reportTime":"2026-08-05T13:00:00.000Z","temp":28,"dewp":24,"wdir":180,"wspd":6,"visib":"6+","altim":1009,"qcField":0,"metarType":"METAR","rawOb":"METAR SKSM 051300Z 18006KT 160V220 9999 NSC 28/24 Q1009","lat":11.12,"lon":-74.231,"elev":5,"name":"Santa Marta/Bolivar Arpt, MA, CO","cover":"CLR","clouds":[],"fltCat":"VFR"}]
